{
  "format": "honua.sdk-capability-baseline/v1",
  "component": "geospatial-mcp",
  "minimumServerVersion": "first-release",
  "requiredCapabilities": [
    "ai.mcp-discovery",
    "discovery.capability-manifest"
  ],
  "capabilities": {
    "ai.mcp-discovery": {
      "versionModel": "semver",
      "introductionModel": "first-release",
      "evidence": {
        "uri": "https://github.com/honua-io/honua-release/blob/0dd9b7a37ab4ee0dd02c17632e3de9e9eeeeddbd/certification/sources/server-publication-history.v1.json",
        "sha256": "sha256:3069fde14a32cc579e4ee92cbe7e86bd88a14c1405df94457e1393c63fe092d1"
      }
    },
    "discovery.capability-manifest": {
      "versionModel": "semver",
      "introductionModel": "first-release",
      "evidence": {
        "uri": "https://github.com/honua-io/honua-release/blob/0dd9b7a37ab4ee0dd02c17632e3de9e9eeeeddbd/certification/sources/server-publication-history.v1.json",
        "sha256": "sha256:3069fde14a32cc579e4ee92cbe7e86bd88a14c1405df94457e1393c63fe092d1"
      }
    }
  }
}
